<?xml version="1.0" encoding="UTF-8"?>
<!-- created by 赶紧毕业 Group2 71117123张建东 71117124湛钊-->
<MovieRank total="1" xmlns:xsi="http://www.w3.org/2001/XMLSchema-instance" xsi:noNamespaceSchemaLocation="doubanSchema.xsd">
	<Retrieve time="2020-03-02"/>
	<Movie Rank="1">
		<Name>
			<StandardName>肖申克的救赎</StandardName>
			<OtherName>月黑高飞(港)</OtherName>
			<OtherName>刺激1995(台)</OtherName>
			<OtherName>地狱诺言</OtherName>
			<OtherName>铁窗岁月</OtherName>
			<OtherName>消香克的救赎</OtherName>
		</Name>
		<Rating>9.7</Rating>
		<Category type="剧情"/>
		<Category type="犯罪"/>
		<Intro>20世纪40年代末，小有成就的青年银行家安迪（<keyword>蒂姆·罗宾斯 Tim Robbins
        </keyword> 饰）因涉嫌杀害妻子及她的情人而锒铛入狱。在这座名为肖申克的监狱内，
            希望似乎虚无缥缈，终身监禁的惩罚无疑注定了安迪接下来灰暗绝望的人生。未过多久，
            安迪尝试接近囚犯中颇有声望的瑞德（<keyword>摩根·弗里曼 Morgan Freeman</keyword>饰）
            ，请求对方帮自己搞来小锤子。以此为契机，二人逐渐熟稔，安迪也仿佛在鱼龙混杂、罪恶横生、
            黑白混淆的牢狱中找到属于自己的求生之道。他利用自身的专业知识，帮助监狱管理层逃税、洗黑钱，
            同时凭借与瑞德的交往在犯人中间也渐渐受到礼遇。表面看来，他已如瑞德那样对那堵高墙从憎恨转变
            为处之泰然，但是对自由的渴望仍促使他朝着心中的希望和目标前进。而关于其罪行的真相，似乎
            更使这一切朝前推进了一步……
        　　本片根据著名作家<keyword>斯蒂芬·金（Stephen Edwin King）</keyword>的原著改编。</Intro>
		<Date>1994-09-10</Date>
		<Length>142</Length>
		<Director>弗兰克·德拉邦特</Director>
		<ScriptWriter>弗兰克·德拉邦特</ScriptWriter>
		<ScriptWriter>斯蒂芬·金</ScriptWriter>
		<ActorList>
			<Actor>蒂姆·罗宾斯</Actor>
			<Actor>摩根·弗里曼</Actor>
			<Actor>鲍勃·冈顿</Actor>
			<Actor>威廉姆·赛德勒</Actor>
			<Actor>克兰西·布朗</Actor>
		</ActorList>
	</Movie>
</MovieRank>
